Hotel,Short Description,Block,City,Province,Amenities,Price Range,Room Count,Reviews,Nearby Landmarks,Nearby Transporation
City Garden GRAND Hotel,"Luxury hotel with 2 restaurants, near A. Venue Mall ",8008 Makati Avenue corner,Makati,Manila,"['Free WiFi', 'Free parking', 'Pool', 'Bathtub', 'Gym', 'Air Conditioning']",3172,311,"[{'reviewee name': 'Edgar', 'rating': 10.0, 'trip type': '2 night trip', 'comment': 'very friendly staff.'}, {'reviewee name': 'Alejandro', 'rating': 8.0, 'trip type': '1 night trip', 'comment': 'Very nice place.. very comfortable..\n👍👍👍👍👍'}, {'reviewee name': '', 'rating': 10.0, 'trip type': '1 night trip with friends', 'comment': 'The hotel is the hidden gem of the city! The rooms are very clean up to the last detail, including the towels and bed linens. Furniture in the room is flawless and is obviously maintained. I had a great time with my friends in the hotel because of the quick and personal service of all the staff. The service in this hotel is incomparable! Buffet breakfast selection and quality exceeded my expectations as a foodie. I also went to the Firefly Roof Deck Bar and the Swimming Pool on the 32nd floor and it is awesome! Magnificent 360 city view, great food, and drinks. I will definitely return! Highly recommended!'}, {'reviewee name': 'Ernest', 'rating': 10.0, 'trip type': '1 night trip', 'comment': 'Wonderful experience '}, {'reviewee name': 'Francis', 'rating': 8.0, 'trip type': '3 night family trip', 'comment': 'Good:\nExcellent location. Very near restaurants, shopping malls, massage spas, coffee shops, 7-11. Easily accessible by city transportation like Grab. Along the intersection of two main city thoroughfares. Comfortable bed and pillows. Functioning air conditioning system. Fast check in and check out. Very courteous staff (housekeeping guy at the 23rd floor during day duty - Vincent, reception, duty manager - Marga).\n\nBad:\nVery slow elevators. Very long waiting time for our food to arrive, 30 minutes (main restaurant 7th floor). Very slow response of guest services to a request for TV remote control (more than 1 hour). One evening, a male housekeeping staff knocked on our door despite that the “do not disturb” light was on.'}, {'reviewee name': '', 'rating': 10.0, 'trip type': '1 night family trip', 'comment': 'The place is cozy.'}, {'reviewee name': 'David', 'rating': 4.0, 'trip type': '3 night family trip', 'comment': 'Found cockroach in my bed\r\nWas bitten several times '}, {'reviewee name': 'Joerg', 'rating': 10.0, 'trip type': '1 night family trip', 'comment': 'Elevators are very slowly. Long waiting times'}, {'reviewee name': '', 'rating': 10.0, 'trip type': '2 night family trip', 'comment': 'The experience was great!'}, {'reviewee name': '', 'rating': 10.0, 'trip type': '1 night romance trip', 'comment': 'Great hotel...accessible also for nearby stores and resto..'}, {'reviewee name': 'Bahram', 'rating': 8.0, 'trip type': '7 night business trip', 'comment': 'Hotel was fine, but I have a major complain for booking.com(Expedia) about their purchasing policy and lack of customer support when needed👎👎👎👎👎👎👎👎'}, {'reviewee name': 'Miharo_love', 'rating': 10.0, 'trip type': '1 night trip with friends', 'comment': 'The front desk is very accommodating and  room service is fast. Even the guards are very friendly.'}, {'reviewee name': 'Wayne', 'rating': 10.0, 'trip type': '2 night trip', 'comment': 'Great very Friendly, Nice Place.. Just need to Fix they beds as they Make a loud noise when moving on them (If you know what i men) Cal also hear the guest next door. Wooden leg on wooden floor? Other than that no complaints. '}, {'reviewee name': 'Shaun', 'rating': 8.0, 'trip type': '3 night romance trip', 'comment': 'Good service good hotel and good area if you know where you are going '}, {'reviewee name': 'Kenneth', 'rating': 10.0, 'trip type': '2 night family trip', 'comment': 'Our stay was good as always.  We like the hotel and its location and the staff are all friendly and accommodating.  The food at the spice restaurant is good and the manager and female server was very kind to us.  \r\n'}, {'reviewee name': 'Sandra', 'rating': 8.0, 'trip type': '6 night family trip', 'comment': 'Not satisfied of fixing/cleaning the room coz they forget to put all the things that u need such as tissue paper for the bathroom, or replenish towels after they take them to wash, and they only fix the bed and NOT clean the entire room, besides than that, everyone is very helpful and nice.'}, {'reviewee name': '', 'rating': 4.0, 'trip type': '3 night trip with friends', 'comment': 'Awful experience!'}, {'reviewee name': 'Sunny', 'rating': 6.0, 'trip type': '3 night business trip', 'comment': 'Policy for guests credit card must be enhanced as card security carries zero fault tolerance. \n\nI have a bad experience with my card.'}, {'reviewee name': '', 'rating': 10.0, 'trip type': '1 night romance trip', 'comment': 'Very nice overall'}, {'reviewee name': '', 'rating': 4.0, 'trip type': '2 night business trip', 'comment': 'Booked superior room but allocated a standard room with a view to a towering concrete pillar'}, {'reviewee name': '', 'rating': 10.0, 'trip type': '2 night family trip', 'comment': 'Although it was a busy day at the hotel, lots of people at the pool, we still had a relaxing and fun stay.'}, {'reviewee name': '', 'rating': 8.0, 'trip type': '1 night family trip', 'comment': 'I like the roofdeck  view and the live band at night.'}, {'reviewee name': 'Steven', 'rating': 6.0, 'trip type': '1 night trip', 'comment': 'Nice room but not a very good area. Definately not for children of good conservatives.'}, {'reviewee name': 'ida', 'rating': 10.0, 'trip type': '1 night family trip', 'comment': ''}, {'reviewee name': 'DIVINA', 'rating': 10.0, 'trip type': '1 night trip with friends', 'comment': 'we enjoyed our stay in this very clean hotel! service is excellent and relaxing stay. thank u looking forward for our next stay.. i will recommend to friends and relatives.'}]","['In Makati Downtown', 'Glorietta Mall - 21 min walk', 'Makati Medical Center - 24 min walk', 'A. Venue Mall - 3 min walk', 'Ayala Center - 20 min walk', 'Greenbelt Shopping Mall - 21 min walk', 'RCBC Plaza - 21 min walk', 'SM Makati - 25 min walk', ""St Luke's Medical Center Global City - 40 min walk"", 'Century City - 2 min walk', 'Makati City Hall - 11 min walk']","{'airport': ['Ninoy Aquino Intl. Airport (MNL) - 26 min drive '], 'train-station': ['Manila Buenidia Station - 3 min drive ', 'Manila San Andres Station - 4 min drive ', 'Manila Vito Cruz Station - 4 min drive '], 'metro': ['Ayala Station - 25 min walk', 'Ayala Center Station - 25 min walk', 'Guadalupe Station - 28 min walk']}"
Dusit Thani Mactan Cebu Resort,Lapu-Lapu beach hotel with 2 restaurants and spa ,Punta Engano Road,Lapu-Lapu,Cebu,"['Free WiFi', 'Free parking', 'Pool', 'Airport transfer', 'Bathtub', 'Gym']",8311,272,"[{'reviewee name': '', 'rating': 10.0, 'trip type': '1 night family trip', 'comment': 'Amazing and very accommodating. Place is splendid and got an upgrade. Will be back for sure... '}, {'reviewee name': 'Danny', 'rating': 10.0, 'trip type': '1 night family trip', 'comment': 'We are so pleased in our stay.we will definitely comeback'}, {'reviewee name': 'Krystal Marie', 'rating': 6.0, 'trip type': '1 night trip with friends', 'comment': 'Too crowded. Food for breakfast is less than what you paid for. Staff were not even checking guests. People come in and out.\nWhen we requested housekeeping, we called thruce but no one came.\nIts way too pricey for what it offers. \nNot worth the monet.'}, {'reviewee name': 'Maricel', 'rating': 10.0, 'trip type': '1 night family trip', 'comment': 'It was really fun my children love swimming and also we love the views of the hotel but one thing only our room aircon is not that so cold but we manage the condition. Over all it was worth it.'}, {'reviewee name': '', 'rating': 10.0, 'trip type': '1 night trip with friends', 'comment': 'Short but extremely sweet stay at Dusti Thani Mactan. Wonderful service, beautiful pool, spacious room and delicious food. Definitely coming back soon. '}, {'reviewee name': 'Evelyn', 'rating': 10.0, 'trip type': '1 night trip with friends', 'comment': 'amazing'}, {'reviewee name': '', 'rating': 10.0, 'trip type': '2 night romance trip', 'comment': 'Spectacular hotel. Everything Specially the service is excellent, I would recommend this place to everyone, shout out to Marx who went out of his way to make sure my husband & I was comfortable since I am disabled. Love love this place.'}, {'reviewee name': 'Emmanuel', 'rating': 8.0, 'trip type': '2 night trip', 'comment': ""Do not get their airport transfer service. They use a third party concessionaire who did not have the proper credentials to enter the airport arrivals pick up points. We had to walk up a level and across the departure area to the Waterfront Hotel just to board the van. In addition, we had to stop at a gas station because the driver came in with soft tires.  Worse, driver did not even apologize for the inconvenience. Thankfully, the concierge service guy who picked us up was very nice and even offered to ask his duty manager to waive the transportation fee (which apparently was declined since we still got invoiced for that). Reviews about the poor workmanship in the rooms especially the shower are true. Frontdesk said we were upgraded but the room we got had a terrible balcony view. Food and wine/cocktails were great though (albeit a bit limited and simple). And every staff we encountered were very helpful. Location is a bit far from other establishments but i guess you have to trade that for the spectacular ocean view. If you have the budget you probably won't mind staying here. But if you want value for your money and expects some sort of luxury at this price point. This may not be the place for you.""}, {'reviewee name': 'Ulf', 'rating': 6.0, 'trip type': '7 night trip with friends', 'comment': 'Unfortunatly is the hotel situated far from a good beach and far from Ceby city. Only 2 restaurants to choose for dinner.'}, {'reviewee name': 'Kevin', 'rating': 10.0, 'trip type': '3 night family trip', 'comment': 'Location & staff were great. Only downside which effects the entire area is the traffic & road conditions HOWEVER did notice the construction to fix that issue. \nBeautiful area & wonderful people!!!'}, {'reviewee name': '', 'rating': 8.0, 'trip type': '2 night family trip', 'comment': 'Hotel and our room were clean, had a a problem with sink but immediately fixed. services were good. they act promptly upon request despite lack of man power. \r\n\r\nThey gave us a cake for free after inquiring about having a cake for my wife’s birthday.\r\n\r\nloved the Infinity pool and the scenery, and breakfast.\r\n\r\nLocation is quite far, with free shuttle service from hotel to Robinson cebu and Ayala. Hotel lobby is quite hot. \r\n\r\nOverall, the stay was good, hotel/staff/services still need to improve. '}, {'reviewee name': 'Zeanath', 'rating': 8.0, 'trip type': '3 night family trip', 'comment': 'There was a problem with our rooms. I requested connecting rooms two months before our check-in and my reservation was considered paid 13 days prior to our check-in and they gave us two separate rooms.  It was a very poor customer service and I complained about it.  The management after  few hours decided to upgrade us to a two bedroom suite . The rest of our stay was great. Staff were polite and friendly.  We love their 4 cheese pizza. The best 4 cheese pizza for us so far. '}, {'reviewee name': '', 'rating': 10.0, 'trip type': '1 night trip with friends', 'comment': 'the location was perfect for tourist and the amenities was superb and the food was so delicious.  recommendable to friends and families'}, {'reviewee name': 'Chloe', 'rating': 8.0, 'trip type': '1 night romance trip', 'comment': 'We decided to book last minute after missing our flight. Our stay was quick but relaxing. However, the hotel was 70% done — limited rooms, amenities, and menu. They even forgot to allocate trash bins in each of the public toilet cubicles. We got the seaview room. It was okay, nothing fancy. I wouldn’t call the hotel luxury. The rooms and overall facilities felt like a business hotel with a resort feel — think Quest Hotel or Seda Hotel by the beach. Service was good though and the staff were friendly. However, if you want luxury, Shangri-La Mactan Resort is better (more expensive too). The rooms at The Radisson Hotel are also more high end.'}, {'reviewee name': 'Gregory', 'rating': 8.0, 'trip type': '1 night trip', 'comment': ""As an expert in the travel business in a bonafide hotel snob, this was a very good experience overall. The rooms are very well appointed, the beds are quite comfortable and the shower and bathrooms are excellent . The television has good pay per view Add the huge pool is hard to beat. Just make sure you bring your own food and your own liquor because it will take them an hour to get you either one of them. All they would have to do is sell 3 drinks at the pool and that would pay for 2 full time servers to scoop up another 40 to 60 drinks per day but obviously using covert as an excuse (and its subsequent understaffing) when in fact they could pay for those staff 10 times over and make the client happy\n\nIf I'm in the pool, I want froxen drinks at least three per day and food with in 25 minutes tops\n\nSuch a shame to furlough staff that extra revenue could easily cashflow.\n\nWe'll be back as we live in town and really enjoyed getting out of the house but next time we'll bring our food and drink.\n\nAs to the food, the carbonara was totally tasteless, saved only by an abundance of aalt and pepper,  the calamari was mediocre and the breakfast was scary. Out of four free buffets, we ate one and sent our driver to Macdonalds. The burger is quite good""}, {'reviewee name': 'Gina', 'rating': 10.0, 'trip type': '1 night family trip', 'comment': 'Excellent, we Will surely stay here again! We’re glad we stay here at Dusit Thani! '}, {'reviewee name': '', 'rating': 10.0, 'trip type': '1 night family trip', 'comment': 'Nice, Clean facility  and staff is so friendly. My family and I really enjoyed are stay. '}, {'reviewee name': 'Samantha', 'rating': 10.0, 'trip type': '1 night trip', 'comment': 'Just wondered why they gave us 1 queen-sized bed whereas in my reservation it was clearly stated there 2 king beds. Anyway the overall stay was awesome. Just hoping that next time the booking must match the reality  '}, {'reviewee name': '', 'rating': 10.0, 'trip type': '1 night family trip', 'comment': 'We had an amazing staycation at Dusit. Very clean and very accommodating staffs. '}, {'reviewee name': '', 'rating': 10.0, 'trip type': '2 night trip with friends', 'comment': 'Clean, nice amenities, friendly staff, good food. Check in and check out was easy because staff speaks and understand english.'}, {'reviewee name': 'Mark', 'rating': 10.0, 'trip type': '4 night trip', 'comment': 'Overall this hotel was great, I would recommend spending time at the Sunset Bar; especially during happy hour. I did, however, wish there was more of a variety of restaurants to eat from. We mainly ate at the bar, due to the lunch/ dinner buffet being expensive. The hotel has amazing views with '}, {'reviewee name': 'LOH', 'rating': 10.0, 'trip type': '3 night trip', 'comment': 'Our stay at Dusit Thani was fantastic!\nThe staff are very friendly and helpful, from the front desk to the housekeeping and life guard at the beach front.\nWe had most of our meals at the Sea Breeze Restaurant, the staff are cheerful, always serving with smiles, especially Felcon who will attend to our needs for the recommendation of local dishes.\n\n\n'}, {'reviewee name': '', 'rating': 10.0, 'trip type': '3 night family trip', 'comment': 'The property is beautiful.  It is not quite complete yet so it will be even more beautiful when done.  It would be helpful to have a shop for travel necessities as shops are far from here. Also a salon would  a nice addition for those needing this service for a special event like I did.  Fortunately Ian was helpful in finding a makeup artist to come to the hotel.'}, {'reviewee name': '', 'rating': 10.0, 'trip type': '1 night family trip', 'comment': 'Dusit Thani were very accomodating from booking to check out. Very responsive to enquiries which I was very impressed. They handled my booking on behalf of my friend professionally. Warm welcome and all amenities are value for money!'}, {'reviewee name': 'Antonio', 'rating': 8.0, 'trip type': '2 night family trip', 'comment': ' It was clean and beautiful but the front desk did not inform us that my driver was there to pick us up at 0900. He told the front desk to call us up but failed to call my room. My driver waited till almost 1200 pm on my check out time. 3 hours was lost on our day. Traffic was now bad going to Cebu. Failure to call my room that my driver was not acceptable. Next time when a request is made do it right away. We also have a time table to make.'}]","['In Punta Engaño', 'Magellan Shrine - 2.3 mi / 3.8 km', 'Mactan Marina Mall - 6.2 mi / 10 km', 'Cebu Yacht Club - 6.4 mi / 10.3 km', 'Gaisano Grand Mall Mactan - 6.8 mi / 11 km', 'Lapu-Lapu City Hall - 7.3 mi / 11.8 km', ""Mactan Doctors' Hospital - 6.3 mi / 10.2 km"", 'Marcelo Fernan Bridge - 6.9 mi / 11.1 km', 'The Outlets at Pueblo Verde - 7.1 mi / 11.5 km', 'Gaisano Island Mall Mactan - 7.8 mi / 12.6 km', 'Our Lady of the Rule Church - 8.3 mi / 13.4 km']","{'airport': ['Mactan - Cebu Intl. Airport (CEB) - 38 min drive '], 'shuttle': ['Airport shuttle (surcharge)']}"
Le Monet Hotel,"4-star hotel with winery, near Camp John Hay ",Ordonio Drive Camp John Hay,Baguio,Benguet,"['Free WiFi', 'Free parking', 'Pool', 'Gym', 'Air Conditioning']",3843,70,"[{'reviewee name': 'Jane Marie', 'rating': 8.0, 'trip type': '1 night family trip', 'comment': 'Good view, strong water pressure, convenient location.'}, {'reviewee name': '', 'rating': 8.0, 'trip type': '2 night family trip', 'comment': 'Room Amenities were downsized. Breakfast selections are few due to covid. But staff are working hard serving that we just overlook missing orders. Rooms need some renovations and improvement'}, {'reviewee name': '', 'rating': 6.0, 'trip type': '2 night trip', 'comment': 'Room was ok..no air conditioning \nService was ok\nFood was ok'}, {'reviewee name': '', 'rating': 8.0, 'trip type': '2 night family trip', 'comment': 'That bubble machine outside was nice.....wifi was slow.  Other than that...everything was good'}, {'reviewee name': 'Lilia', 'rating': 6.0, 'trip type': '1 night family trip', 'comment': 'when we got in to the room we realize that the air con remote its not available in our room so my husband called the front desk and they told us that my reservation is booked without aircon.  As far i can remember in my reservation it never  mention of having with or with out aircon. At that time my husband called while i was at the shower so he told me about what happened so i called again and i brougt my concern and they told us that the person who took the complain made a mistake and didnt bother to call back to correct the mistake. We expected the staff to be well-trained.  Second, around 12midnight there no water for some reason.  I was disappointed.\n'}, {'reviewee name': '', 'rating': 10.0, 'trip type': '2 night family trip', 'comment': 'Toilet is 😍'}, {'reviewee name': 'joemar', 'rating': 6.0, 'trip type': '1 night family trip', 'comment': ""Stay is good, staffs are very helpful.\r\n\r\nNOTE: Wifi / Internet is very important to me. I'm disappointed with their internet speed. I hope you can check and offer a faster internet connection.""}, {'reviewee name': 'thelma', 'rating': 10.0, 'trip type': '4 night romance trip', 'comment': 'great stay,everything was perfect,during our stay i had a medical emergency,and the staff and management went out of their way to help sort it out,many thanks to everybody.'}, {'reviewee name': 'Arnold', 'rating': 10.0, 'trip type': '1 night family trip', 'comment': 'Very nice place and location'}, {'reviewee name': '', 'rating': 10.0, 'trip type': '2 night family trip', 'comment': 'great staff'}, {'reviewee name': 'Dannie', 'rating': 8.0, 'trip type': '2 night family trip', 'comment': 'Why is there always ""human hair"" on the food? We stayed there for two days, and there is always human hair on the salad, corned beef etc.'}, {'reviewee name': 'Niki', 'rating': 10.0, 'trip type': '1 night family trip', 'comment': 'Great hotel! On the small side (lobby, dining area and pool) yet the rooms are very comfortable and area is right where we want to be. Good food and very courteous staff. Pool water is warm. The stay would’ve been perfect if we got the forest view room we booked. Unfortunately, the online site overbooked and we got a park view instead. However, the staff was very apologetic and kind enough to provide breakfast for my little girls since they couldn’t refund the difference in room rate. They’ve also been very helpful in providing us the rooms next to each other since I booked 2. Will definitely come back as well as recommend to others. '}, {'reviewee name': '', 'rating': 10.0, 'trip type': '2 night family trip', 'comment': 'good location'}, {'reviewee name': 'Aimee Rose', 'rating': 10.0, 'trip type': '1 night family trip', 'comment': 'This is my nephew’s birthday getaway. The staff made his day by greeting him and giving him a cake. He enjoyed swimming the most. He also got a persinalized keycard as requested. We enjoyed the view from our veranda and slept peacefully on their comfy pillows and bed. The buffet breakfast was sumptuos. Will spend more celebrations there.'}, {'reviewee name': 'Karlo', 'rating': 6.0, 'trip type': '1 night romance trip', 'comment': ""I didn't like the many flies in the buffet area. I didn't like as well that I didn't see any tangible effort to address the problem.""}, {'reviewee name': 'Lovely Anne', 'rating': 8.0, 'trip type': '1 night family trip', 'comment': 'Hotel was okay, they just need to re orient their front desk staff on the additional person charges since they are not sure how to charge my children.'}, {'reviewee name': 'Lovely Anne', 'rating': 8.0, 'trip type': '1 night family trip', 'comment': 'Overall it was good only irritating part was front desk misinformed us of the charges for add’l person and child rate. They billed us incorrectly on our 1st breakfast but corrected it on our 2nd day. '}, {'reviewee name': 'CAMR', 'rating': 10.0, 'trip type': '1 night business trip', 'comment': 'Scenery provided thru the room balcony. Hotel massage was also good.'}, {'reviewee name': '', 'rating': 6.0, 'trip type': '2 night family trip', 'comment': ""No consideration for guests who traveled from MNL. They let all of the guests wait until almost 2pm even if it is obvious that there were very few guests checked in (note: about 5 cars parked in their parking lot). To make matters worse, they initially lost my info sheet where all my vital information are indicated (complete address, phone, birthday etc). Only when I threatened that I will complain to the Nat'l Privacy Commission did they really look for the missing document. This is not how the #1 hotel in Baguio (which is just nearby) operates. I don't think I will go back.""}, {'reviewee name': 'Mary', 'rating': 10.0, 'trip type': '2 night family trip', 'comment': ""Location is very accessible to restaurants with good food and outdoor activities. Staff is excellent. They're very attentive and consistently gives good service. I think this is my 6th visit to this hotel. I never consider any other place to stay in Baguio.""}, {'reviewee name': '', 'rating': 8.0, 'trip type': '4 night trip', 'comment': 'Wonderful experience!'}, {'reviewee name': 'Lily', 'rating': 8.0, 'trip type': '2 night trip', 'comment': 'The room was nice but it was noisy due to the passing cars since it’s infront of the road. The cr although the interior was nice emits a foul smell especially in the sink. In the morning, they have a poor water supply that there was no flush and very few water from the shower. I had to make a call to inform them about it but they were quick to attend to my concern. Not all the staff were friendly.'}, {'reviewee name': '', 'rating': 10.0, 'trip type': '1 night trip', 'comment': 'Satisfied stay'}, {'reviewee name': 'Mark', 'rating': 10.0, 'trip type': '2 night trip', 'comment': 'Clean, Cozy rooms, Nice bathroom, Friendly staff, and even the guards are good and friendly! '}, {'reviewee name': '', 'rating': 10.0, 'trip type': '1 night trip', 'comment': 'Love the overall vibe of the hotel. Staff are friendly. The hotel is close to Ayala Techno Hub and Mile Hi Center so lots of restaurants to choose from. Their breakfast is the bomb! 😀'}]","['Camp John Hay - 2 min walk', 'SM City Baguio - 28 min walk', 'Teachers Camp - 37 min walk', 'Burnham Park - 39 min walk', 'Baguio Botanical Garden - 32 min walk', 'Baguio Cathedral - 34 min walk', 'Baguio Convention Center - 27 min walk', 'Baguio Mountain Province Museum - 29 min walk', 'Session Road - 31 min walk', 'The Mansion - 36 min walk', 'Mines View Park - 2.5 mi / 4.1 km']",{'shuttle': ['Free area shuttle']}
