Hotel,Short Description,Block,City,Province,Amenities,Price Range,Room Count,Reviews,Nearby Landmarks,Nearby Transporation
Ascott Bonifacio Global City Manila,"Upscale apartment with kitchen, near St Luke's Medical Center Global City ",28th Street corner 5th Avenue,Taguig,Manila,"['Free WiFi', 'Free parking', 'Airport transfer', 'Bathtub', 'Kitchen', 'Non-smoking']",8976,180,"[{'reviewee name': '', 'rating': 10.0, 'trip type': '1 night trip', 'comment': 'Very happy with our stay - helpful staff, comfortable facilities, proximity to shops & restaurants'}, {'reviewee name': '', 'rating': 10.0, 'trip type': '6 night trip', 'comment': 'Amazing'}, {'reviewee name': 'Bea', 'rating': 8.0, 'trip type': '1 night family trip', 'comment': 'Overall the place and people were very nice. The only hitches were the following:\n- I booked for 3 people but the cost for the 3rd person was not part of the cost emailed to me. Upon check-in, that is when I was advised that I had to pay for the 3rd person separately even if I clearly stated that there would be 3 adults in the room.\n- I had to ask for the roll away bed, towels, etc even after I had already paid for the 3rd person\n- the room description was 1 bedroom but it was essentially a studio with a sofa on the side\n- the air conditioning was not very cool even after engineering checked it out.'}, {'reviewee name': 'Mark Anthony', 'rating': 10.0, 'trip type': '1 night family trip', 'comment': 'Great staff and as always the room is perfect.'}, {'reviewee name': '', 'rating': 10.0, 'trip type': '1 night family trip', 'comment': 'Had a wonderful staycation with family.  Everything was nice, especially the location.'}, {'reviewee name': '', 'rating': 10.0, 'trip type': '1 night romance trip', 'comment': 'I love this hotel. Rooms are huge. Comfy bed and pillows. The kitchen is beautiful with all the essentials. Breakfast are ok. Wish we stayed longer. '}, {'reviewee name': 'Daniel', 'rating': 10.0, 'trip type': '1 night trip', 'comment': 'Excellent bed, huge space and delightful breakfast. Best thing though? The location! '}, {'reviewee name': 'Nereo', 'rating': 10.0, 'trip type': '1 night romance trip', 'comment': 'Very good stay. Room was ready even when we arrived an hour early. Staff are very nice'}, {'reviewee name': '', 'rating': 10.0, 'trip type': '3 night trip', 'comment': 'Fantastic !!!!!!!!'}, {'reviewee name': 'Lin', 'rating': 10.0, 'trip type': '1 night family trip', 'comment': 'Bkfast could be improved. My kids were not impressed.'}, {'reviewee name': 'Ahmed', 'rating': 8.0, 'trip type': '3 night romance trip', 'comment': 'Everything were in a place except there was no smoking area '}, {'reviewee name': 'Philip', 'rating': 10.0, 'trip type': '6 night business trip', 'comment': 'Not my first time at Ascott BGC -- they changed food vendors at the hotel and it showed at the breakfast buffet very much improved!!!'}, {'reviewee name': 'MA BARBARA', 'rating': 10.0, 'trip type': '1 night family trip', 'comment': 'Hotel in general was superb.  Room size and amenities were topnotch.  Breakfast had a very good spread and was worth waking up to.  Location was perfect.  Very close to the shopping area and lots of restaurants to choose from.  '}, {'reviewee name': 'Derryman', 'rating': 10.0, 'trip type': '3 night trip', 'comment': 'Excellent hotel Good location \nStaff always friendly and most helpful '}, {'reviewee name': '', 'rating': 10.0, 'trip type': '1 night trip', 'comment': 'Cleanliness and clean feel. Like the interior design. It doesn’t look cheap. \n\nDon’t like that it’s only valet parking option for guest.'}, {'reviewee name': 'Ken', 'rating': 10.0, 'trip type': '2 night business trip', 'comment': 'Very clean as always. Good access to airport and also very near to restaurant area.'}, {'reviewee name': '', 'rating': 10.0, 'trip type': '1 night romance trip', 'comment': 'just in front of high street\nmust smoke in parking floor, B3'}, {'reviewee name': '', 'rating': 8.0, 'trip type': '2 night trip', 'comment': 'Price is good & includes fairly good breakfast. Pool bar'}, {'reviewee name': 'SDE', 'rating': 10.0, 'trip type': '2 night business trip', 'comment': 'Everything is exceptional. Great customer service. Very clean and spacious room. Excellent amenities.'}, {'reviewee name': 'RC', 'rating': 10.0, 'trip type': '2 night family trip', 'comment': 'Staffs are always ready to assist us.\nProperty is clean and in good location.'}, {'reviewee name': 'J-', 'rating': 8.0, 'trip type': '1 night family trip', 'comment': 'Frequent guests should be given more accommodation especially for early or late check in/out.'}, {'reviewee name': 'Sean', 'rating': 10.0, 'trip type': '4 night romance trip', 'comment': 'Great breakfast and gym although they could use a squat rack for their Olympic bar.  Staff friendly and helpful'}, {'reviewee name': '', 'rating': 10.0, 'trip type': '1 night family trip', 'comment': 'Beautiful property. Very clean. Great location. First class.'}, {'reviewee name': 'Alvin', 'rating': 10.0, 'trip type': '3 night trip', 'comment': 'Amazing stay at this hotel. will definitely stay there again when i come back.'}, {'reviewee name': 'Lum', 'rating': 10.0, 'trip type': '3 night family trip', 'comment': 'Staff were friendly and helpful. Property in close proximity to restaurants and shopping. Highly recommended.'}]","['In Bonifacio Global City', 'Fort Bonifacio - 15 min walk', 'Venice Grand Canal Mall - 30 min walk', 'Glorietta Mall - 39 min walk', ""St Luke's Medical Center Global City - 7 min walk"", 'Bonifacio High Street - 8 min walk', 'Ayala Malls: Market! Market! - 16 min walk', 'SM Makati - 39 min walk', 'A. Venue Mall - 42 min walk', 'Ayala Center - 45 min walk', 'Philippines Stock Exchange - 1 min walk']","{'airport': ['Ninoy Aquino Intl. Airport (MNL) - 28 min drive '], 'train-station': ['Manila EDSA Station - 5 min drive ', 'Manila Buenidia Station - 6 min drive ', 'Manila Pasay Road Station - 6 min drive '], 'shuttle': ['Airport shuttle (surcharge)']}"
Crimson Hotel Filinvest City Manila,"Mountain hotel with 2 bars/lounges, near Starmall Alabang ","Entrata Urban Complex, 2609 Civic Drive",Muntinlupa,Manila,"['Free WiFi', 'Free parking', 'Pool', 'Airport transfer', 'Gym', 'Air Conditioning']",3745,345,"[{'reviewee name': 'Robin', 'rating': 10.0, 'trip type': '3 night trip', 'comment': ""It's a very wonderful stay. Everrhing thing is well taken care off.""}, {'reviewee name': 'Siva', 'rating': 2.0, 'trip type': '2 night family trip', 'comment': 'Not good experience. I book the club level room with access to club level and this was an incentive for my son for doing well in the exams. It was the week-end and we were told we cannot enter the club lounge in shorts. I have stayed there many times and used the lounge in shorts. then they told me I can come in shorts but hide inside a board room. I decided to check-out 1 hours later to be told I can come in short to lounge. I checked out, forfeited my two night costs and left the hotel and told them I will never stay there again'}, {'reviewee name': '', 'rating': 6.0, 'trip type': '1 night family trip', 'comment': 'The hotel location is good just walking distance to Festival Mall. There was no complimentary bottled water because according to them they are eco-friendly which is good but when I requested for a laundry bag, they gave me a clear plastic bag.'}, {'reviewee name': '', 'rating': 4.0, 'trip type': '1 night family trip', 'comment': 'The hotel has deteriorated..bathroom is dirty. They even charge P150.00 for the utensils and P75.00 for the ice bucket..\nCheck in and check out are a horendous process of wait..\nI will never go back here again nor will I recommend this hotel to others. '}, {'reviewee name': '', 'rating': 8.0, 'trip type': '1 night family trip', 'comment': 'Fast check-in. Friendly staff. Good amenities'}, {'reviewee name': '', 'rating': 2.0, 'trip type': '1 night family trip', 'comment': 'At first we adviced the front desk that we are going to be late for check in....but then when we arrived i thought we already have a room since i book it 3 weeks  ahead...but we dont have..they said that its still in process of cleaning....we waited at least 20 mins before we finally check...but when my wife removed the comforter she saw a shoe lace in the middle of the bed.....itsnun acceptable for that kind of hotel..then our room has no microwave...chiller that meant only for their drinks....borrowing plates and bucket of ice will cost you hundreds of pesos...they said all rentals..theres additional charges.....and im disappointed also that the pool that time is closed they said due to taal ashfall...i will not recommend this hotel to others...vivere is way way better\n...'}, {'reviewee name': 'Ronald', 'rating': 8.0, 'trip type': '2 night family trip', 'comment': 'Crimson accommodated us with short term notice as a result of the Taal Volcano eruption. The rates are reasonable with what you get more than other hotels of the same price range. The service staff is terrific and with its location being near a mall and a supermarket you tend to get things quicker with less time. We were taken a back though when they charge us for ice and utensils primary because most guests tend to order out rather than eat in due mainly to the cost of room service and more importantly the choices you got. Food delivery is a common thing now hence we suggest that the hotel adapt to these changes on what competition outside dining is offering. '}, {'reviewee name': '', 'rating': 8.0, 'trip type': '1 night family trip', 'comment': 'had a great staycation for Christmas 2019! hotel is a 5-minute walk or maybe less to Festival mall. free shuttle was also convenient going to the mall and back to the hotel. just make sure u wait at the pick-up/drop-off before the scheduled time.\nactivity for kids (w/ light snack) at one of the ballrooms was a plus. \nbreakfast for 2 adults and 2 kids was worth-it, variety was just right (bacon, eggs, beef pares, chicken adobo, fried bangus, creamy veggies, soup, fruits, breads, etc) . wish there were some chocolate cereal or similar type for the kids.  \noverall room, amenities and food met or even exceeded my expectation for the price I paid. \nthank you! :)'}, {'reviewee name': 'DIANNE TWINKLE', 'rating': 10.0, 'trip type': '1 night trip', 'comment': 'it was a fun short stay. i would definitely go back no hastle with checking and checkout. '}, {'reviewee name': 'John', 'rating': 4.0, 'trip type': '2 night family trip', 'comment': 'We were put right in front of where an activity was even when they knew we had 2 kids without informing us of it. They struggled to sleep as it was too noisy. They moved us to another floor the next day om the other side of the hotel. We were there to relax but was stressed cause of the kids the first day. Will never go back there again'}, {'reviewee name': 'Mark&Richard', 'rating': 10.0, 'trip type': '1 night romance trip', 'comment': 'Very accommodating and beautiful place to stay at.\nWe got to Manila earlier than we expected and they did an early check in for us with room options.\nThank you guys so much and definitely we will be staying there again on our next trip to Philippines 😊'}, {'reviewee name': '', 'rating': 10.0, 'trip type': '2 night family trip', 'comment': 'The property is in great condition. Enjoy every part of it.'}, {'reviewee name': 'carl', 'rating': 6.0, 'trip type': '1 night family trip', 'comment': 'It is a great hotel really. I like the food in the restaurant and their staff. The room has a great view outside but they only have one shower bathrobe and it stinks. Seems the bathrobe wasn’t washed for a long time. I hope they will improve that when I come back soon. There is no laundry bag either...'}, {'reviewee name': '', 'rating': 10.0, 'trip type': '1 night family trip', 'comment': 'Amazing stay.'}, {'reviewee name': '', 'rating': 10.0, 'trip type': '1 night family trip', 'comment': ""Crimson is our family's favourite hotel in Alabang.  The staff are all helpful. We got upgraded to a two double bed without extra expense on our part. Swimming pool is clean and great.""}, {'reviewee name': 'Glenda', 'rating': 10.0, 'trip type': '1 night romance trip', 'comment': 'Excellent'}, {'reviewee name': 'Louis', 'rating': 10.0, 'trip type': '2 night business trip', 'comment': 'Everything about my stay at the Crimson was positive. '}, {'reviewee name': '', 'rating': 6.0, 'trip type': '1 night business trip', 'comment': 'stayed there before but their quality seems to have deteriorated. water in a small pitcher? who knows how long that water has been there. they recycle the slippers. slippers looked used.'}, {'reviewee name': '', 'rating': 6.0, 'trip type': '1 night family trip', 'comment': 'Was given the wrong room when I checked in..next day I requested for a bathrobe, didn’t came, called to follow up, still didn’t came..was asked if I still need it but I’m about to check out..won’t be needing it for sure'}, {'reviewee name': '', 'rating': 10.0, 'trip type': '4 night business trip', 'comment': 'Courteous and prompt'}, {'reviewee name': 'Duckie', 'rating': 6.0, 'trip type': '2 night family trip', 'comment': 'nothing extraordinary'}, {'reviewee name': '', 'rating': 10.0, 'trip type': '1 night family trip', 'comment': 'superb pool for my kids'}, {'reviewee name': '', 'rating': 6.0, 'trip type': '1 night family trip', 'comment': 'Delayed checked in'}, {'reviewee name': 'ma cristina', 'rating': 10.0, 'trip type': '2 night romance trip', 'comment': 'im so comfortable.'}, {'reviewee name': '', 'rating': 8.0, 'trip type': '4 night family trip', 'comment': 'nice place for relaxation'}]","['In Alabang', 'Starmall Alabang - 7 min walk', 'Alabang Town Center - 23 min walk', 'Asian Hospital and Medical Center - 8 min walk', 'Festival Supermall - 8 min walk', 'SM City Southmall - 2.6 mi / 4.2 km', 'Ayala Center - 10.7 mi / 17.2 km', 'Enchanted Kingdom - 12 mi / 19.3 km', 'SM Mall of Asia - 12.2 mi / 19.7 km', 'Manila Zoo - 13.3 mi / 21.4 km', 'Manila Ocean Park - 14.6 mi / 23.5 km']","{'airport': ['Ninoy Aquino Intl. Airport (MNL) - 31 min drive '], 'train-station': ['Manila Alabang Station - 11 min walk ', 'Manila Nichols Station - 10 min drive ', 'Manila Bicutan Station - 10 min drive '], 'shuttle': ['Airport shuttle (surcharge)']}"
The Forest Lodge at Camp John Hay,"Mountain hotel with golf course, near Camp John Hay ",Loakan Road,Baguio,Benguet,"['Free WiFi', 'Parking available', 'Non-smoking']",3881,96,"[{'reviewee name': '', 'rating': 10.0, 'trip type': '1 night romance trip', 'comment': 'It’s very nice'}, {'reviewee name': 'Samuel', 'rating': 8.0, 'trip type': '2 night family trip', 'comment': 'Close to the Manor\n\nCheck out is 11am with the letter slipped into the door. I do not like this since its unfair considering checkin is 2pm.'}, {'reviewee name': '', 'rating': 10.0, 'trip type': '3 night family trip', 'comment': 'I like the location being inside camp John Hay .'}, {'reviewee name': '', 'rating': 8.0, 'trip type': '2 night trip', 'comment': 'We werent ale to relax because every night there are plates being heard and other noises we hear.'}, {'reviewee name': 'Eli', 'rating': 10.0, 'trip type': '2 night trip with friends', 'comment': 'Peace and being away from city traffic'}, {'reviewee name': '', 'rating': 10.0, 'trip type': '3 night family trip', 'comment': 'Check out time is too early!'}, {'reviewee name': '', 'rating': 10.0, 'trip type': '2 night family trip', 'comment': 'The place is perfect for the Christmas season because of the ambience and facilities. What ruined our stay was the presence of boisterous and inconsiderate guests in one room who partied there and the management belatedly reprimanded them. After somebody complained perhaps. There should be a strict policy on this so that the other guests would not be disturbed.'}, {'reviewee name': '', 'rating': 10.0, 'trip type': '2 night family trip', 'comment': 'We had a wonderful time at Forest Lodge CJH. Everything is perfect!'}, {'reviewee name': '', 'rating': 6.0, 'trip type': '2 night family trip', 'comment': 'The environment and quite place'}, {'reviewee name': '', 'rating': 8.0, 'trip type': '2 night family trip', 'comment': 'It was palatable meaning not first class but not rubbish missing Buffett breakfast we had last time we came but manor is always there'}, {'reviewee name': '', 'rating': 8.0, 'trip type': '2 night romance trip', 'comment': 'The cozy environment & hospitable staff.'}, {'reviewee name': 'LLang', 'rating': 6.0, 'trip type': '1 night family trip', 'comment': ""I love being at Camp John Hay. I rented 2 rooms for my family. I booked online for 2 rooms and for some reason, I couldn't book 2 same type rooms at the same time from my cell phone. Anyway, we checked in and were assigned our rooms. We then get a phone call that our room is the wrong room and they had to move us to a smaller room. We ended up in a room that had a bathroom that would not flush. We literally ended up using the bathroom in the lobby. It was very inconvenient . I didn't complain anymore cause my husband was too tired to move rooms again.""}, {'reviewee name': '', 'rating': 8.0, 'trip type': '1 night trip with friends', 'comment': 'Quiet and good location'}, {'reviewee name': '', 'rating': 10.0, 'trip type': '2 night family trip', 'comment': 'Everything'}, {'reviewee name': 'Zar', 'rating': 10.0, 'trip type': '3 night trip', 'comment': ""i liked that it isn't too close to the main road. the location is quiet and my room had a view of the pine trees.""}, {'reviewee name': 'Fmadrid', 'rating': 10.0, 'trip type': '2 night family trip', 'comment': 'The event was a bit loud, but the lady at the reservation desk was kind enough to transfer us to another room farther from the event, so it was ok and we appreciate it :) Thank you.'}, {'reviewee name': '', 'rating': 8.0, 'trip type': '1 night romance trip', 'comment': 'Our stay,was ok...'}, {'reviewee name': '', 'rating': 8.0, 'trip type': '3 night business trip', 'comment': 'Nothing really to say'}, {'reviewee name': '', 'rating': 8.0, 'trip type': '2 night family trip', 'comment': 'Haha the hills.'}, {'reviewee name': 'Angelie', 'rating': 10.0, 'trip type': '2 night family trip', 'comment': 'Our stay in Forest Lodge was great. The room was spacious and extremely clean. The Wifi in the room could have been better'}, {'reviewee name': '', 'rating': 8.0, 'trip type': '1 night family trip', 'comment': 'Everything is ok..BUT the BREAKFAST MUST BE INCLUDED AS COMPLIMENTARY like most of the hotels'}, {'reviewee name': '', 'rating': 10.0, 'trip type': '1 night trip with friends', 'comment': 'Great place to stay when in Baguio. The place is very homey and the rooms are very clean. The staff is also very friendly and accommodating. The hotel is in the middle of interesting places as well.'}, {'reviewee name': 'Preny', 'rating': 6.0, 'trip type': '2 night family trip', 'comment': ""Staff were good and attentive of our needs, just surprised when I requested for laundry bags and slippers I was told that they can't provide us more than 2 pcs each despite the fact that we were 3 in the room. 😥😥😥""}, {'reviewee name': '', 'rating': 8.0, 'trip type': '2 night romance trip', 'comment': 'The Location was Amazing! The Customer Service was Great! . The only problem we’ve had was the hot water pressure was so low and the temperature was not hot enough as well. '}, {'reviewee name': 'Catherine', 'rating': 8.0, 'trip type': '2 night family trip', 'comment': 'Check in was a breeze. Our room however was run down and the carpets were filthy. My son was running around barefoot for only a few minutes and his feet were practically black from the filth. Room was spacious but with a confusing layout. A lot of bare corners and oddly placed furniture. Other than that it was a pleasant stay'}]","['In a national park', 'Camp John Hay - 13 min walk', 'Teachers Camp - 31 min walk', 'SM City Baguio - 37 min walk', 'Baguio Botanical Garden - 26 min walk', 'Baguio Cathedral - 43 min walk', 'Mines View Park - 43 min walk', 'The Mansion - 30 min walk', 'Baguio Convention Center - 36 min walk', 'Baguio Mountain Province Museum - 38 min walk', 'Baguio Bamboo Sanctuary - 38 min walk']",{}
