Hotel,Short Description,Block,City,Province,Amenities,Price Range,Room Count,Reviews,Nearby Landmarks,Nearby Transporation
"Edsa Shangri-La, Manila","Luxury hotel with full-service spa, connected to a shopping center, near Shangri-La Mall
","1 Garden Way, Ortigas Center",Pasig,Manila,"['Free WiFi', 'Free parking', 'Pool', 'Airport transfer', 'Gym', 'Air Conditioning']",4600,631,"[{'reviewee name': 'Rey', 'rating': 10.0, 'trip type': '2 night family trip', 'comment': 'Fabulous overall service, specially from the poll side bartender (Marivi) & from the concierge desk for providing us with directions/transportation options.'}, {'reviewee name': '', 'rating': 10.0, 'trip type': '1 night family trip', 'comment': 'Nice room but the restroom is little old style already? Hospitality of the people there are amazing :)'}, {'reviewee name': 'Riza Mae', 'rating': 4.0, 'trip type': '1 night family trip', 'comment': 'It was very frustrating that we have to look for our own parking outside due to full parking, I was with my 13 year old son and 4 year old daughter, both minor and really hard for us to search outside the premises of the hotel. You should prioritize those who check in other than the guest from your weekends event. I thought I will have a relaxing stay, because I didnt went home in Pampanga to avoid traffic on Saturday. Really not familiar with the area.'}, {'reviewee name': 'David', 'rating': 10.0, 'trip type': '2 night trip', 'comment': 'Locations good'}, {'reviewee name': '', 'rating': 4.0, 'trip type': '1 night family trip', 'comment': 'DON’T BOOK FOR NYE. Unless you enjoy non-air conditioned hallways, stained carpets and bed sheets, No bath tubs, generic brand breakfast items (Tasted like Argentina Corned beef, CDO longganisa) with just two types of rice- white and garlic, served in an uninspired ballroom. They were more concerned with quantity vs quality. Staff was courteous and did their best, but def not worth the 13K we paid for the night.'}, {'reviewee name': '', 'rating': 4.0, 'trip type': '1 night family trip', 'comment': 'no parking. slow service. (but the effort is there)'}, {'reviewee name': 'Louie', 'rating': 10.0, 'trip type': '2 night trip', 'comment': 'This is a self-contained place, with Malls and a hospital just around the corner! Very helpful and polite staff! One drawback is that it’s right in the middle of traffic gridlock called EDSA: it takes hours to get out of this gridlock...and easy driving once one is out of it!'}, {'reviewee name': '', 'rating': 10.0, 'trip type': '2 night romance trip', 'comment': 'I like everything except the room rate doesnt include the breakfast'}, {'reviewee name': 'Zoe', 'rating': 8.0, 'trip type': '1 night family trip', 'comment': 'Check in was pleasant. Very accommodating staff'}, {'reviewee name': '', 'rating': 8.0, 'trip type': '1 night family trip', 'comment': 'Great location. The room is clean but you can tell it is quite old. Overall, a good stay.'}, {'reviewee name': '', 'rating': 10.0, 'trip type': '1 night romance trip', 'comment': 'What can you expect from Shangrila chain of hotels? Superb in every way'}, {'reviewee name': '', 'rating': 10.0, 'trip type': '1 night business trip', 'comment': 'I loved their excellent service. Everyone was very helpful and friendly. High class and efficient. 👍'}, {'reviewee name': 'ZINON', 'rating': 10.0, 'trip type': '1 night romance trip', 'comment': ''}, {'reviewee name': 'Mike', 'rating': 10.0, 'trip type': '1 night family trip', 'comment': 'Perfect place for a staycation'}, {'reviewee name': 'LADY VIRGIE', 'rating': 10.0, 'trip type': '1 night family trip', 'comment': 'the staff are so nice. they upgraded us to the suite floor. it was anawesome experience for my kids. love love it\r\n'}, {'reviewee name': '', 'rating': 10.0, 'trip type': '1 night business trip', 'comment': 'Mostly like including food and location'}, {'reviewee name': 'Marissa', 'rating': 8.0, 'trip type': '1 night family trip', 'comment': 'good'}, {'reviewee name': 'Mary Karen Ann', 'rating': 8.0, 'trip type': '1 night family trip', 'comment': 'Excellent!'}, {'reviewee name': 'J.', 'rating': 10.0, 'trip type': '1 night business trip', 'comment': 'The service was excellent.'}, {'reviewee name': '', 'rating': 10.0, 'trip type': '1 night romance trip', 'comment': 'Happy to stay, they deserve my 10 starss'}, {'reviewee name': '', 'rating': 10.0, 'trip type': '1 night trip', 'comment': 'Excellent.  Superb'}, {'reviewee name': '', 'rating': 10.0, 'trip type': '1 night family trip', 'comment': 'Great hotel. More importantly, the kids had fun in the play area and pool area.'}, {'reviewee name': 'Aileen', 'rating': 10.0, 'trip type': '2 night business trip', 'comment': 'Good for couples & kids.... great pool... adjacent to 2 big malls.'}, {'reviewee name': 'Sherry Rose', 'rating': 4.0, 'trip type': '1 night family trip', 'comment': 'Took us a long time checking in. The receptionist was so unfriendly'}, {'reviewee name': '', 'rating': 10.0, 'trip type': '1 night trip', 'comment': 'lovely stay as always.. Love the Shang !'}]","['In Wack-Wack Greenhills', 'Shangri-La Mall - 4 min walk', 'SM Megamall - 7 min walk', 'Robinsons Galleria Mall - 16 min walk', 'Greenhills Shopping Center - 37 min walk', 'Asian Development Bank Headquarters - 11 min walk', 'A. Venue Mall - 2.8 mi / 4.4 km', 'Century City - 2.9 mi / 4.7 km', 'Makati City Hall - 2.9 mi / 4.7 km', 'Power Plant Mall - 3.1 mi / 4.9 km', ""St. Luke's Medical Center - 4.5 mi / 7.2 km""]","{'airport': ['Ninoy Aquino Intl. Airport (MNL) - 38 min drive '], 'train-station': ['Manila Paco Station - 7 min drive ', 'Manila Santa Mesa Station - 7 min drive ', 'Manila Buenidia Station - 8 min drive '], 'metro': ['Shaw Boulevard Station - 8 min walk', 'Ortigas Avenue Station - 12 min walk', 'Boni Avenue Station - 19 min walk'], 'shuttle': ['Airport shuttle (surcharge)']}"
Batad Highland Inn and Restaurant,No-frills Banaue hotel with restaurant ,Nueva Vizcaya-Ifugao-Brgy Batad,Banaue,Ifugao,['Airport transfer'],625,6,"[{'reviewee name': 'Przemeyslaw', 'rating': 8.0, 'trip type': '3 night trip', 'comment': ''}]","['Batad Rice Terraces - 3 min walk', 'Tappiya Falls - 16 min walk', 'Banaue Rice Terraces - 10.8 mi / 17.4 km', 'Banaue Museum - 9.7 mi / 15.6 km']",{'shuttle': ['Airport shuttle (surcharge)']}
Seda Abreeza,"4-star hotel with restaurant, connected to a shopping center, near Abreeza Mall
","J.P. Laurel Ave., Bajada",Davao,Davao,"['Free WiFi', 'Free parking', 'Pool', 'Airport transfer', 'Air Conditioning']",3705,186,"[{'reviewee name': 'Narisa', 'rating': 8.0, 'trip type': '1 night business trip', 'comment': ''}, {'reviewee name': 'ImeldaSantos', 'rating': 10.0, 'trip type': '5 night trip', 'comment': 'across a shopping mall.\nstaff are very friendly and helpful'}, {'reviewee name': 'Frank', 'rating': 10.0, 'trip type': '2 night business trip', 'comment': 'Felt like home'}, {'reviewee name': '', 'rating': 8.0, 'trip type': '1 night family trip', 'comment': 'Nice, near a mall but no parking area and no enough staff to carry your luggages'}, {'reviewee name': 'Edwin', 'rating': 6.0, 'trip type': '1 night business trip', 'comment': 'Everything was okay except the air conditioning part. The thermostat of the rooms were at 19C even if wanted it to be at 25C. I was transferred to another room but still the thermostat was at 19C. It would have been fine if it was summer but it’s October. '}, {'reviewee name': '', 'rating': 8.0, 'trip type': '1 night business trip', 'comment': 'Close to the Mall\nDidn’t get to check-in until 4:30pm'}, {'reviewee name': '', 'rating': 10.0, 'trip type': '2 night trip with friends', 'comment': 'The staff are so friendly and clearly like what they’re doing. Special mention to the executive  lounge staff '}, {'reviewee name': '', 'rating': 10.0, 'trip type': '1 night business trip', 'comment': ''}, {'reviewee name': '', 'rating': 10.0, 'trip type': '3 night business trip', 'comment': 'Location was very good for our purpose- business and pleasure. \nClub room was quiet and convenient for business meeting.'}, {'reviewee name': '', 'rating': 10.0, 'trip type': '1 night business trip', 'comment': 'Adjacent to Shopping Mall and Restaurants.   Food served in the hotel are good.'}, {'reviewee name': 'NDV', 'rating': 10.0, 'trip type': '3 night business trip', 'comment': 'I love the hotel staff and how the housekeeping department ensures cleanliness of the room.'}, {'reviewee name': 'NDV', 'rating': 10.0, 'trip type': '3 night business trip', 'comment': 'Friendliness of staff. Breakfast options are also good. It keeps on changing every day.'}, {'reviewee name': '', 'rating': 10.0, 'trip type': '1 night business trip', 'comment': 'My home in Davao\r\nI always stay at Seda'}, {'reviewee name': 'NDV', 'rating': 10.0, 'trip type': '3 night business trip', 'comment': 'The friendliness of hotel staff.'}, {'reviewee name': 'Zteiob', 'rating': 8.0, 'trip type': '1 night romance trip', 'comment': 'Everything is ok except during our stay skycable was not available and there was no alternative provided by the hotel. No TV during our 3 day stay :) we mssed the Wimbledon semis and finals.'}, {'reviewee name': '', 'rating': 10.0, 'trip type': '2 night family trip', 'comment': 'Excellent room\nExcellent wifi connection\nLocation is convenient for Abreeza mall and 711\nGood breakfast buffet'}, {'reviewee name': '', 'rating': 10.0, 'trip type': '1 night family trip', 'comment': 'Super nice place love it'}, {'reviewee name': 'Gilbert', 'rating': 10.0, 'trip type': '2 night family trip', 'comment': 'The staff are helpfull and  creative  breakfast was awesome,'}, {'reviewee name': '', 'rating': 10.0, 'trip type': '1 night romance trip', 'comment': 'I have stayed here numerous times and I enjoy here every time. This is one of my favorite hotels to stay at. I also invite my family and friends to come over and use the swimming pool. Breakfast buffet is also good. Overall my stay here was excellent.'}, {'reviewee name': '', 'rating': 6.0, 'trip type': '2 night romance trip', 'comment': 'The hotel itself is okey. I am not happy with the greyish towel. Their pillow cases and bedsheets doesnt look newly changed to me. '}, {'reviewee name': '', 'rating': 2.0, 'trip type': '1 night business trip', 'comment': 'Aircon would not go colder than 26 degrees celsius/centigrade..'}, {'reviewee name': 'Michael', 'rating': 10.0, 'trip type': '2 night romance trip', 'comment': 'Excellent facility, very good location for dining and shopping. Exceptional staff that are friendly and helpful. Fantastic breakfast buffet will satisfy any desire.'}, {'reviewee name': 'Sallie', 'rating': 8.0, 'trip type': '1 night trip', 'comment': 'This is our favorite hotel in Davao City! The hotel staff are very friendly, courteous and helpful.\nIts location is very convenient for us, as it is just across the Abreeza Mall!'}, {'reviewee name': '', 'rating': 10.0, 'trip type': '1 night family trip', 'comment': 'Awesome room'}, {'reviewee name': '', 'rating': 8.0, 'trip type': '2 night family trip', 'comment': 'The good thing about this hotel is it’s located just right across abreeza mall. The lobby area, restaurant and the pool is too small. I went there for a family trip and my first time in davao so i dont know much about the area so if you’re planning for a family trip or vacation this hotel is not for you. you better choose the hotel at samal island'}]","['In Poblacion District', 'Gaisano Mall - 20 min walk', 'SMX Convention Center Davao - 31 min walk', 'Abreeza Mall - 1 min walk', 'Victoria Plaza - 9 min walk', 'Mindanao Taoist Temple - 17 min walk']","{'airport': ['Francisco Bangoy Intl. Airport (DVO) - 23 min drive '], 'shuttle': ['Airport shuttle (surcharge)']}"
Nigi Nigi Nu Noos “e” Nu Nu Noos,"3-star beachfront hotel with restaurant, near White Beach ","Barangay Manggayad, Station 2, Malay",Boracay Island,Aklan,"['Free WiFi', 'Airport transfer', 'Air Conditioning']",2135,25,"[{'reviewee name': 'Kenneth', 'rating': 8.0, 'trip type': '4 night trip with friends', 'comment': 'The place was nice and right on the beach. Decent food and good service. One issue I experienced was on the app it stated 24 hour check in. However, upon arrival I was informed 2pm was check in time. We had to wait just over an hour. I would stay there again. '}, {'reviewee name': 'Horst', 'rating': 10.0, 'trip type': '4 night romance trip', 'comment': ""Great location on the beach. Bamboo huts are built in traditional style surrounded by well maintained tropical garden. Rooms are quiet and private with excellent room service. Staff was very friendly and helpful. Live band every evening in the bar area. Can't wait to go back.....""}, {'reviewee name': '', 'rating': 10.0, 'trip type': '2 night family trip', 'comment': 'Amazing!'}, {'reviewee name': 'raymond', 'rating': 10.0, 'trip type': '3 night family trip', 'comment': 'An extremely nice resort.  Very accommodating with great customer service.  A nightly band and a well stocked bar.  Not to loud and very relaxing.  Very native looking when most of the other resorts are all concrete and glass.  Has to be one of the last original looking resorts.  The eggs benedict are to die for.'}, {'reviewee name': '', 'rating': 8.0, 'trip type': '3 night family trip', 'comment': 'Loved room and staff and location.\n\nHate the crowd that the bar brings in at night time. Old white men and young prostitutes... cant bring the family out at night time.'}, {'reviewee name': 'GEOFF', 'rating': 8.0, 'trip type': '3 night romance trip', 'comment': 'Staff very friendly , carnt do enough for us .'}, {'reviewee name': 'Ron', 'rating': 10.0, 'trip type': '2 night romance trip', 'comment': 'Clean.....Accommodating....Great Location.....Good Food.....VERY GOOD STAFF AND SERVICE!!!'}, {'reviewee name': '', 'rating': 8.0, 'trip type': '2 night family trip', 'comment': 'Close to the beach and food is great!'}, {'reviewee name': 'Clarena', 'rating': 10.0, 'trip type': '3 night romance trip', 'comment': 'My sister and her hubby enjoyed their 3nights stay with Nigi. They were well taken cared for. They enjoyed their free breakfasts. They loved the location as it was right smack in the middle and they were not bothered at all by noise from the island when they get into their room. My cousin and i enjoyed our stay here as well way way back and it is the only cottage style accommodation then. We are used to the typical hotel so Nigi was i think the most island-feel-like accommodation in the island. This was our family’s birthday gift to my sister and her hubby, both dec celebrants, and i had to make sure i booked them in Nigi. I made the right choice!! To the wonderful staff, from the booking until the end, you were very acommodating, thank you very much!! Please please keep up the good work as for sure we will keep recommending your place 👏👏👏👍👍👍❤️❤️❤️ God bless yoh more guys!!! '}, {'reviewee name': 'Timothy', 'rating': 10.0, 'trip type': '1 night trip', 'comment': ""The Nigi Nigi is my family's hotel of choice in Boracay. Beautiful garden, great rooms, and wonderful food. Chef Mike runs a great kitchen! ""}, {'reviewee name': '', 'rating': 6.0, 'trip type': '14 night romance trip', 'comment': 'The property was pretty cool, nice and quiet where our room was located.  Beds were a little uncomfortable and the pillows were not great (bring your own).  Getting hand and face towels were challenging, but the bar staff was great and the atmosphere at the bar and entertainment was fantastic.  No lounge chairs allowed on the beach was disappointing as you have nowhere to relax unless it is on a towel on the sand. but other than that we had a great holiday until disaster stuck with the Covid-19 virus scare and the Manila shutdown on our last few days which required hours and hours of phone calling to get sorted.  The staff at the Nigi were not really helpful.'}, {'reviewee name': 'KimB', 'rating': 10.0, 'trip type': '3 night family trip', 'comment': 'It was a unique experience staying in a comfortable Nipa cottage. Aircon was good. The space was huge. \nThey kept the grounds well maintained and clean as well. \nIts right in front of the beautiful white sand beach. \nAbout 10 minute walk to D mall. \nThe food was good. I love their coffee!\nWould definitely stay again.'}, {'reviewee name': 'JAA', 'rating': 8.0, 'trip type': '3 night family trip', 'comment': 'Wifi connection was poor. Furniture and bathroom amenities were old but clean. Needs updating. Staff service was excellent.'}, {'reviewee name': 'Roselo', 'rating': 10.0, 'trip type': '3 night trip with friends', 'comment': 'Very happy stay at this hotel. Nice and very friendly staff.Nice and very clean room. HIGHLY recommended. '}, {'reviewee name': 'Jordyn', 'rating': 6.0, 'trip type': '4 night trip with friends', 'comment': ""Overall the hotel is ok. For people who want to party and be near the action this is a good place. For those who want to relax by the beach, a hotel further away from the stations is better. Decent price but would pay more for a quiet place with hot water next time.\n\nLocated in station 2 in the middle of all the action and on the beach. Spacious rooms and free beach towels for rent. The breakfast voucher for my group was 340 pesos/per, anything more than that you pay for which is fine because they offer cheap breakfast. Service can be slow at breakfast so leave an hour if you have to meet for a tour. \n\nWifi cuts out often so you have to ask for a new code. The shower was the biggest disappointment. Lukewarm water that changed every 10 sec from warm to cold. Noise level is moderate. If your room is on the bottom the stomping from upstairs will be very loud. You can hear the music from nearby bars (which is fine if you're partying). The blinds for our room were see through at night which made us two girls feel unsafe. ""}, {'reviewee name': 'Maja', 'rating': 10.0, 'trip type': '4 night family trip', 'comment': 'Exellent!'}, {'reviewee name': 'Winona', 'rating': 10.0, 'trip type': '4 night trip', 'comment': 'Room was beautiful. Location is amazing, right in the middle of white sand beach walk. Loved the flexibility of the free breakfast policies.  Room was amazingly quiet considering bar had an amazing band, quickly learned to take off shoes outside Of room to avoid tracking lots of sand into room from the beach.  Even the public bathrooms for the bar were spotlessly clean.  Only small struggle was getting the safe working. Also loved the welcome non alcoholic banana shake delivered to the room. Curtains were beautiful but a bit difficult for a short person to arrange for privacy.  Overall fabulous resort!'}, {'reviewee name': '', 'rating': 10.0, 'trip type': '2 night family trip', 'comment': 'We like this place everything was excellent and we can recommend to our friends'}, {'reviewee name': 'David', 'rating': 10.0, 'trip type': '1 night trip', 'comment': 'Nice rooms. Clean. Would stay there again. '}, {'reviewee name': 'randall', 'rating': 4.0, 'trip type': '7 night trip', 'comment': 'Staff were very nice, location too busy for us and not enough for my partner to really enjoy herself.'}, {'reviewee name': 'Kerri', 'rating': 8.0, 'trip type': '7 night family trip', 'comment': 'Fantastic location right on the beach, the staff are really friendly and the happy hour cocktails are terrific 😀'}, {'reviewee name': 'Brian', 'rating': 10.0, 'trip type': '2 night trip', 'comment': 'This place was a GEM!  Staff was wonderful, Michael made everyone feel like family.  I will be back, and I will bring my friends, and business acquaintances. '}, {'reviewee name': 'JunC', 'rating': 10.0, 'trip type': '1 night trip with friends', 'comment': ""Can't beat the location. Unique setting, cottages in trees and foliage which dampens the noise. Good food. Very friendly staff. ""}, {'reviewee name': 'CindyTirad', 'rating': 8.0, 'trip type': '4 night trip with friends', 'comment': 'Friendly staff and great customer service .\nFood was delicious '}, {'reviewee name': ""Red'sTravelPlac"", 'rating': 8.0, 'trip type': '1 night family trip', 'comment': ""I liked  the  interior  bamboo walls concept, a nipahut  cottage-style  family room (8 paxs- 6 adults and 2 child) , friendly  staffs  , american breakfast included nicely served , except that the hotel's location a bit crowded and should improve on rooms lighting,  (SLOW  W  I  F  I  !  Not included  on our  review) but overall  experience is above expectations.""}]","['On the beach', 'White Beach - 1 min walk', ""D'Mall Boracay - 10 min walk"", 'Station 2 - 1 min walk', 'Station 1 - 13 min walk', 'Bulabog Beach - 20 min walk', 'Station 3 - 1 min walk', 'Talipapa Market - 3 min walk', 'Department of Tourism Boracay Field Office - 7 min walk', 'Budget Mart - 12 min walk', 'Tulubhan Beach - 18 min walk']","{'airport': ['Kalibo Airport (KLO) - 86 min drive ', 'Caticlan (MPH-Godofredo P. Ramos) - 27 min drive '], 'shuttle': ['Airport shuttle (surcharge)']}"
