Hotel,Short Description,Block,City,Province,Amenities,Price Range,Room Count,Reviews,Nearby Landmarks,Nearby Transporation
Clark Marriott Hotel,"Luxury hotel with 6 restaurants, near Clark Freeport Zone ",5398 Manuel A Roxas Highway,Mabalacat City,Pampanga,"['Free WiFi', 'Free parking', 'Pool', 'Non-smoking', 'Gym', 'Air Conditioning']",8118,260,"[{'reviewee name': 'P', 'rating': 10.0, 'trip type': '1 night family trip', 'comment': 'Clark Marriott Hotel is fabulous!\nSuperb accommodation and service! \nGreat dinner buffet as well! \nWe had an awesome stay and great New Year celebration! \nWill definitely go back at this fantastic hotel! \nThanks Marriott! '}, {'reviewee name': '', 'rating': 8.0, 'trip type': '1 night family trip', 'comment': 'Excellent ameneties'}, {'reviewee name': 'Bryan', 'rating': 10.0, 'trip type': '1 night romance trip', 'comment': 'New hotel with good facilities and service.i did not have time to check the pool but rooms are very comfortable and spacious. The breakfast is over priced but has a wide selection. The location is poor but then Clark has little to offer the traveller apart from some golf courses. Overall if you can manage the cost this is a very nice hotel.'}, {'reviewee name': 'Joselito', 'rating': 2.0, 'trip type': '1 night romance trip', 'comment': 'Very dissapointed and upset. I booked for a deluxe room, 2 double beds, balcony with breakfast buffet for 2 but we were denied the free breakfast at checked in. I expect to get what I paid for for this reservation or is this what happens when you redeemed your free nights that you don’t get exactly what you booked for because of the discount? I demand an explanation on this matter. Thank you'}, {'reviewee name': 'Pat', 'rating': 10.0, 'trip type': '1 night family trip', 'comment': 'the rooms are great and comfortable and  it was nice to have the sauna and jacuzzi located near the pool area'}, {'reviewee name': 'Essie', 'rating': 10.0, 'trip type': '1 night trip', 'comment': 'Excellent 5 star experience. From the room to the buffet breakfast! Everything was perfect!'}, {'reviewee name': '', 'rating': 8.0, 'trip type': '1 night trip', 'comment': 'Nice view with clean and class a amenities.'}, {'reviewee name': 'Edward', 'rating': 4.0, 'trip type': '2 night family trip', 'comment': 'Hotel just opened 2 months ago, so service is so poor. Staff still not familiar with standards, routine and customer care '}, {'reviewee name': 'L', 'rating': 6.0, 'trip type': '1 night trip', 'comment': 'Staff were accomodating. Room is new and clean. However, nobody informed us that our room accomodations give us access to the executive lounge 24/7, and told us only access for breakfast. Only learned about it from relatives almost a month after our stay.'}, {'reviewee name': '', 'rating': 10.0, 'trip type': '1 night trip', 'comment': 'Staffs are accomodating'}, {'reviewee name': 'Russell', 'rating': 10.0, 'trip type': '1 night business trip', 'comment': 'the hotel was beautiful, well laid out, beautiful ambience, the rooms were spacious and very comfortable, the decor was bery comforting and appealing to the eye. The restaurant was fantastic serving up very good food.'}, {'reviewee name': '', 'rating': 8.0, 'trip type': '2 night trip', 'comment': ""Went there this valentine's weekend, The frontdesk reception and concierge serve us well start from check. They also done a great job on helping me prepare a roses suprise in a very short time. \nAlthough the room wasn't totally well maintained (a  chair was bit broken) and smoking area and equipment weren't friendly, but I would back there again due to their worming service. ""}, {'reviewee name': 'Monico', 'rating': 10.0, 'trip type': '1 night family trip', 'comment': 'Very covinience place and a full relax ambience !!!'}, {'reviewee name': '', 'rating': 4.0, 'trip type': '1 night trip with friends', 'comment': ""My second time staying here. Wanted to give them a chance after a disappointing stay last time. \n\nMy problem this time is the shower. The shower's hot option is not working. Reported it and they maintenance was coming but it did not. Followed up again. But it was night already and still maintenance didn't show up and just let it go. Although they brought an apology fruit basket but still issue was not fixed. Was not happy with my stay. \n\nAlso, balcony is too dusty and seemed no one cleaned it.""}, {'reviewee name': '', 'rating': 10.0, 'trip type': '5 night romance trip', 'comment': ""Just an overall beautiful hotel. Can't complain about anything. What's more, after checkout wife left her jacket in a closet and didn't miss it until the following day. She had an envelope in her pocket containing 10,000.00. The jacket and it content had been turned in by room service. She retrieved the jacket and its content the next day  and left 1000.00 reward for the person who turned it in.""}, {'reviewee name': '', 'rating': 4.0, 'trip type': '1 night trip', 'comment': ""I was actually quite disappointed for a few reasons:\n\nOn the hotels.com site, it is says the room has a shower-tub combination but when I checked in, it's only a shower - no tub. I raised this concern with the reception and they told me the one in hotels.com is not accurate.\n\nAlso, I initially booked the one with the balcony however I noticed that it's a double bed so I told them I only need a king bed which they accommodated me. All this time, it shows in hotels.com that it has the golf view, but when I got to my room, it's not.\n\nAnother thing are the bathroom towels - for a five star hotel, I am expecting nice, fluffy towels but the ones provided to me are just too rough, looks like it has been the towel of the hotel for a very long time. I asked for a new set but it's all the same.\n\nOn a positive note, room is very clean, very relaxing, wifi is fast, people are very nice and accommodating, food is ok. ""}, {'reviewee name': 'emer', 'rating': 8.0, 'trip type': '2 night trip', 'comment': 'World class. Our room is wide, modern   and spacious. We have a view of the golf course. Staff is friendly and helpful. Upgraded to executive lounge but the food is horrible. Otherwise we have a pleasant stay.'}, {'reviewee name': '', 'rating': 10.0, 'trip type': '1 night family trip', 'comment': 'Need updating... The service was awesome. Location was convenient to getting my task completed.'}, {'reviewee name': '', 'rating': 10.0, 'trip type': '1 night family trip', 'comment': 'Fast courteous staff amenities are clean and property smells clean'}, {'reviewee name': 'ASun', 'rating': 10.0, 'trip type': '2 night family trip', 'comment': 'The staff was excellent, very helpful and anticipated our needs.  I traveled with my 6 yr old and they went out of their way to be accommodating.'}, {'reviewee name': 'Boswyck', 'rating': 10.0, 'trip type': '1 night business trip', 'comment': 'Phenomenal staff and customer service...because of them I joined Marriott BonVoy rewards program!'}, {'reviewee name': '', 'rating': 8.0, 'trip type': '1 night romance trip', 'comment': ""I was on the 9th floor and the view was amazing. The security was admirable. The buffet at the ground floor restaurant was delicious and the service was optimal. However, they did not give me a wake up call when I requested it. But given how everything else was great, I'm willing to overlook that. I would recommend this hotel very highly.""}, {'reviewee name': 'Ryan', 'rating': 10.0, 'trip type': '1 night family trip', 'comment': 'Staff are extremely friendly especially Ms. Angelica Pinpin at the front desk and Ms. Alyssa and Ms. Clarissa at the Executive Lounge. Excellent facilities. I will definitely come back and recommend this hotel to others. Thanks'}, {'reviewee name': '', 'rating': 10.0, 'trip type': '16 night business trip', 'comment': 'Excellent as usual. Stayed here in Dec. 2018, Feb, and March-April; consistently a great experience.\r\nRoom was top notch just like the service and the people. Recommended to family, friends and business partners. '}, {'reviewee name': 'Rachael', 'rating': 10.0, 'trip type': '3 night business trip', 'comment': 'Lovely new hotel with great service.  Gym good, pool smaller (about 15m long).  Good selection at breakfast and room service was fast and good quality.  Room very clean.  Bed comfortable but the pillows and mattress topper are too squishy for my preference.  Wifi pretty good.'}]","['In Clark', 'Clark Freeport Zone - 1 min walk', 'Aqua Planet - 41 min walk', 'PAGCOR Mimosa Casino - 19 min walk', 'Fort Stotsenburg - 21 min walk', 'Clark Parade Grounds - 21 min walk', 'Fontana Water Park - 23 min walk', 'Nayong Pilipino - 24 min walk', 'Fontana Casino - 26 min walk', 'Mimosa Golf and Country Club - 26 min walk', 'Clark Air Base Bicentennial Park and Recreation Area - 32 min walk']",{'airport': ['Clark Intl. Airport (CRK) - 13 min drive ']}
Conrad Manila,"Luxury hotel with spa, near SMX Convention Center ","Seaside Boulevard, Corner of Coral Way",Pasay,Manila,"['Free parking', 'Pool', 'Airport transfer', 'Non-smoking', 'Gym', 'Air Conditioning']",6374,347,"[{'reviewee name': 'Nikko', 'rating': 10.0, 'trip type': '2 night family trip', 'comment': 'Very helpful employees from reception, housekeeping, customer service to restaurant staff and concierge.\n\nGave us options to have a more memorable staycation as a family.'}, {'reviewee name': 'Gilbert', 'rating': 6.0, 'trip type': '1 night trip', 'comment': 'when I checked in, they informed me that breakfast was not included\n??????? \nFor a 9 thousand a night stay and no breakfast?\n'}, {'reviewee name': '', 'rating': 10.0, 'trip type': '1 night family trip', 'comment': 'Good food great service'}, {'reviewee name': '', 'rating': 8.0, 'trip type': '1 night family trip', 'comment': '- did not have a chance to experience the executive lounge. It was too far a walk for pwd\n- room view was not as expected'}, {'reviewee name': '', 'rating': 8.0, 'trip type': '2 night trip', 'comment': 'It was okay there were many shops and malls nearby the hotel. Nice and clean environment Great tasting breakfast buffet.'}, {'reviewee name': 'Arvi', 'rating': 10.0, 'trip type': '3 night family trip', 'comment': 'It was all good when you reach the hotel but confirming our room took us 2 days to reach the proper person. The operator doesn’t know anything. Most of the phone numbers just kept on ringing. No one picks up the phone . You have to try to call your published numbers if they work at all '}, {'reviewee name': '', 'rating': 8.0, 'trip type': '3 night family trip', 'comment': 'Vera Good Family vacation. The room is clean but the sofa ang carpet needs to be vacuumed properly. '}, {'reviewee name': 'Alegria', 'rating': 4.0, 'trip type': '1 night trip', 'comment': 'Too expensive amenities is not good difficult to access everything hotel is just like a maze '}, {'reviewee name': 'kin sun', 'rating': 2.0, 'trip type': '2 night family trip', 'comment': 'Their are really unprofessional, socially their front desk duty manager.'}, {'reviewee name': 'richard', 'rating': 10.0, 'trip type': '1 night business trip', 'comment': 'Great Place! No complaints. great view of Manila Bay!'}, {'reviewee name': 'Christine', 'rating': 8.0, 'trip type': '3 night business trip', 'comment': 'They had complete amenities.  Very spacious room.  Extra touches for comfort.  Polite staff '}, {'reviewee name': 'Michael', 'rating': 6.0, 'trip type': '1 night family trip', 'comment': 'When we checked in to the hotel our room had no breakfast at first even we paid for it. We had to show confirmation email that we had and they had to do some calls so we just get out breakfast. So that was settled.\r\nWhen went up to our room we waited for our bags. To our surprise wrong bags were delivered to our room. We had to wait another 20 minutes until the correct bags were brought to our room and it still a mystery how that happened.\r\n\r\nWhen we also wanted to have a cup of coffee there was also no coffee capsules in our room.\r\n\r\nThe past 2 times when we checked in at Conrad we have good experiences but this time it was offly not the standard that we have expected.\r\n\r\n'}, {'reviewee name': 'ernie byron', 'rating': 10.0, 'trip type': '1 night family trip', 'comment': ""our stay is amazing, a once in a lifetime experience. we've been upgraded to presidential suite. staff are nice & accomodating.. everythings perfect.""}, {'reviewee name': 'deborah ann', 'rating': 10.0, 'trip type': '1 night family trip', 'comment': 'best for family with children.convenient location for dining,shopping,watching concert&movie.kids playground is just across the hotel.the staff are friendly and helpful.'}, {'reviewee name': 'Sheryl', 'rating': 2.0, 'trip type': '2 night trip with friends', 'comment': 'The hotel did not honor my prepayment with you and charged my credit card for a guarantee payment upon arrival. I asked them settle the matter with you before I checked out and to contact me during my stay if they will not be able to settle it. I even forwarded my confirmation email from you to their corporate email as requested by the staff. However upon checked out the front desk person asked me to pay my accomodation. When I told her about the issue she was clueless and I have to explain everything all over again for the another time. She had to inquire from the back about the issue that it took so long for me to check out with a supposed to prepaid accomodation and she told me its your fault that this mess happen. '}, {'reviewee name': 'Myrna', 'rating': 8.0, 'trip type': '1 night family trip', 'comment': 'Parking an issue but overall it’s ok. Good location. But crowded on the second floor Resto areas '}, {'reviewee name': 'Joanne', 'rating': 8.0, 'trip type': '1 night family trip', 'comment': 'We had a good stay! We love the clean room and the nice ambiance!\r\n\r\n'}, {'reviewee name': '', 'rating': 10.0, 'trip type': '1 night romance trip', 'comment': 'Nice service! \r\nAnd the exclusive lounge is really good \r\n'}, {'reviewee name': 'Roy', 'rating': 10.0, 'trip type': '1 night romance trip', 'comment': 'Stay was amazing, room was very clean, service was great.  Had breakfast at the Brasserie, was fantastic, lots of choices include Philippine, American, Japanese, Korean, Italian food.   Location is great, walking distance to Mall Of Asia.'}, {'reviewee name': 'Mary Ann', 'rating': 10.0, 'trip type': '1 night family trip', 'comment': 'This hotel has the best staff in the world. Everybody is so helpful and there were smiles everytime you meet them. \r\nThe fact that this hotel is just besides Mall of Asian also make the hotel the best hotel for us.  '}, {'reviewee name': '', 'rating': 10.0, 'trip type': '2 night family trip', 'comment': 'We got upgraded to a Bay View Executive Floor room and it was Awe! Tho it was raining the whole time my family and I still enjoyed our stay. Fast service as always and the location is accessible to the mall.'}, {'reviewee name': '', 'rating': 10.0, 'trip type': '3 night business trip', 'comment': 'nice ambiance'}, {'reviewee name': 'Kenneth', 'rating': 10.0, 'trip type': '1 night family trip', 'comment': ""Incredible hotel with incredible service\r\n\r\nI checked in here last week the day before my graduation at PICC as its close proximity to the venue and also to MOA was perfect for my family. I've always been a fan of this hotel with the beautiful architecture and wonderful staff who greet you at every chance. The incredible hospitality began the moment we got off the elevator into the lobby, being greeted personally by name as some of the staff remembered me from prior visits, as well as greeting even my parents, which sometimes gets overlooked.\r\n\r\nThe concierge escorting us upstairs to the executive lounge heard that I would be missing the breakfast buffet due to my early lineup for graduation, and without missing a beat, he offered to send a breakfast box up at 5am prior to my departure so at least I could eat something. That little gesture was just the beginning of the incredible service ahead.\r\n\r\nSpecial mention to the hosts at the executive lounge: Blanche, Cecile, and Carina who really went out of their way to make us feel welcome. Every chance they had they greeted us kindly with respect and always with a smile. They took care of every request with expedience even to the point that I said I could pour my own coffee haha.\r\n\r\nI hadn't mentioned at all that I was graduating, just merely in passing, but they sent me a cake in the evening congratulating me. All these small gestures really add up to making me feel special and welcome at this hotel. Would recommend Conrad Manila""}, {'reviewee name': 'Cory', 'rating': 4.0, 'trip type': '2 night romance trip', 'comment': 'Checked me in 2-hours late, because room was not ready. Bed bugs bit into my flesh from bathrobe I wore the first night causing 10-15 bites on my legs and arms that ruined my trip. Reported the incident to staff, they were quiet the entire time about the incident, only asking if I saw redspots on my sheets prior to being bitten. I expect better from a 5-star hotel.'}, {'reviewee name': '', 'rating': 10.0, 'trip type': '1 night family trip', 'comment': 'I like everything at Conrad. My Family enjoyed our stay there.'}]","['In Barangay 76', 'SM Mall of Asia - 8 min walk', 'SMX Convention Center - 3 min walk', 'Mall of Asia Arena - 6 min walk', 'World Trade Center Manila - 33 min walk', 'Cultural Center of the Philippines - 44 min walk', ""Children's Museum (Museo Pambata) - 4.2 mi / 6.7 km"", 'Rizal Park - 4.4 mi / 7.1 km', 'Fort Santiago - 5.3 mi / 8.5 km']","{'airport': ['Ninoy Aquino Intl. Airport (MNL) - 17 min drive '], 'train-station': ['Manila Buenidia Station - 6 min drive ', 'Manila Vito Cruz Station - 7 min drive ', 'Manila Paco Station - 7 min drive '], 'shuttle': ['Airport shuttle (surcharge)']}"
Crimson Resort and Spa Mactan,Beachfront hotel in Lapu-Lapu with spa and outdoor pool ,"Seascapes Resort Town, Mactan Island",Lapu-Lapu,Cebu,"['Free WiFi', 'Free parking', 'Pool', 'Airport transfer', 'Bathtub', 'Gym']",5388,290,[],"['On a private beach', 'Magellan Shrine - 34 min walk', 'Gaisano Grand Mall Mactan - 4.1 mi / 6.6 km', 'Mactan Marina Mall - 4.7 mi / 7.5 km', 'Cebu Yacht Club - 4.8 mi / 7.8 km', 'Lapu-Lapu City Hall - 5.8 mi / 9.3 km', 'J Centre Mall - 8.6 mi / 13.9 km', ""Mactan Doctors' Hospital - 4.4 mi / 7.1 km"", 'Marcelo Fernan Bridge - 5.5 mi / 8.9 km', 'The Outlets at Pueblo Verde - 5.7 mi / 9.1 km', 'Gaisano Island Mall Mactan - 6.5 mi / 10.4 km']","{'airport': ['Mactan - Cebu Intl. Airport (CEB) - 10 min drive '], 'shuttle': ['Airport shuttle (surcharge)', 'Area shuttle (surcharge)', 'Free shopping center shuttle']}"
